<?xml version="1.0" encoding="UTF-8" ?>
<!DOCTYPE Maze SYSTEM "dtd.dtd">
<Maze name="Test3" height="3" width="2">
<Items>
		<Hole posX="1" posY="2"/>
		<Box posX="0" posY="1" weight="3"/>
		<Box posX="1" posY="0" weight="1"/>
</Items>
	<Walls>
		<Wall posX="0" posY="0" isSpecial="false" hasDoor="false" orientation="1"/>
		<Wall posX="0" posY="0" isSpecial="false" hasDoor="false" orientation="4"/>
		<Wall posX="1" posY="0" isSpecial="true" hasDoor="false" orientation="1"/>
		<Wall posX="1" posY="0" isSpecial="false" hasDoor="false" orientation="2"/>
		<Wall posX="0" posY="1" isSpecial="false" hasDoor="false" orientation="4"/>
		<Wall posX="0" posY="1" isSpecial="false" hasDoor="false" orientation="3"/>
		<Wall posX="1" posY="1" isSpecial="false" hasDoor="false" orientation="2"/>
		<Wall posX="1" posY="2" isSpecial="false" hasDoor="false" orientation="2"/>
		<Wall posX="1" posY="2" isSpecial="false" hasDoor="false" orientation="3"/>
		<Wall posX="1" posY="2" isSpecial="false" hasDoor="false" orientation="4"/>
	</Walls>
	
</Maze>